{
  "$schema": "http://json-schema.org/draft-07/schema#",
  "$id": "https://tradeops.local/schemas/events/risk/risk.stress_test.completed.v1.json",
  "title": "risk.stress_test.completed v1",
  "type": "object",
  "additionalProperties": true,
  "required": ["eventType", "portfolioId", "riskLevel", "generatedAt"],
  "properties": {
    "eventType": { "type": "string", "enum": ["risk.stress_test.completed"] },
    "eventVersion": { "type": "string" },
    "tenantId": { "type": "string" },
    "correlationId": { "type": "string" },
    "traceparent": { "type": "string" },
    "portfolioId": { "type": "string" },
    "riskLevel": { "type": "string", "enum": ["LOW", "MEDIUM", "HIGH", "CRITICAL"] },
    "worstScenario": { "type": ["string", "null"] },
    "pnlImpactPercent": { "type": "number" },
    "generatedAt": { "type": "string", "format": "date-time" }
  }
}
